{
  "schemaVersion": 2,
  "archetype": "encounter",
  "sport": "football",
  "competition": "worldcup",
  "edition": 1966,
  "status": "closed",
  "teamMode": "country",
  "hosts": [
    "ENG"
  ],
  "teamsCount": 16,
  "results": {
    "champion": "ENG",
    "runnerUp": "FRG",
    "third": "POR",
    "finalMatchId": "m032"
  },
  "coverage": {
    "matches": 159,
    "goals": 482,
    "scorers": 47,
    "scope": "all",
    "complete": true,
    "scorersComplete": false,
    "missingPhases": []
  },
  "sources": [
    {
      "id": "rsssf:66f",
      "name": "RSSSF — World Cup 1966 final tournament (Karel Stokkermans, Sergio Henrique Jarreta)",
      "url": "https://www.rsssf.org/tables/66f.html",
      "retrieved": "2026-10-06",
      "author": "Karel Stokkermans, Sergio Henrique Jarreta",
      "publisher": "RSSSF",
      "license": "rsssf-attribution",
      "redistribute": true
    },
    {
      "id": "rsssf:66full",
      "name": "RSSSF — World Cup 1966 finals, full details",
      "url": "https://www.rsssf.org/tables/66full.html",
      "retrieved": "2026-10-06",
      "publisher": "RSSSF",
      "license": "rsssf-attribution",
      "redistribute": true
    },
    {
      "id": "rsssf:66qf-scor",
      "name": "RSSSF — World Cup 1966 goal scorers (Jaroslaw Owsianski)",
      "url": "https://www.rsssf.org/tables/66qf-scor.html",
      "retrieved": "2026-10-06",
      "author": "Jaroslaw Owsianski",
      "publisher": "RSSSF",
      "license": "rsssf-attribution",
      "redistribute": true
    },
    {
      "id": "rsssf:66q",
      "name": "RSSSF — World Cup 1966 (qualifying)",
      "url": "https://www.rsssf.org/tables/66q.html",
      "retrieved": "2026-10-10",
      "publisher": "RSSSF",
      "license": "rsssf-attribution",
      "redistribute": true
    }
  ],
  "asOf": "2026-10-06",
  "groups": [
    {
      "letter": "A",
      "standings": [
        {
          "team": "ENG",
          "p": 3,
          "w": 2,
          "d": 1,
          "l": 0,
          "gf": 4,
          "ga": 0,
          "pts": 5
        },
        {
          "team": "URU",
          "p": 3,
          "w": 1,
          "d": 2,
          "l": 0,
          "gf": 2,
          "ga": 1,
          "pts": 4
        },
        {
          "team": "MEX",
          "p": 3,
          "w": 0,
          "d": 2,
          "l": 1,
          "gf": 1,
          "ga": 3,
          "pts": 2
        },
        {
          "team": "FRA",
          "p": 3,
          "w": 0,
          "d": 1,
          "l": 2,
          "gf": 2,
          "ga": 5,
          "pts": 1
        }
      ],
      "stage": "group"
    },
    {
      "letter": "B",
      "standings": [
        {
          "team": "FRG",
          "p": 3,
          "w": 2,
          "d": 1,
          "l": 0,
          "gf": 7,
          "ga": 1,
          "pts": 5
        },
        {
          "team": "ARG",
          "p": 3,
          "w": 2,
          "d": 1,
          "l": 0,
          "gf": 4,
          "ga": 1,
          "pts": 5
        },
        {
          "team": "ESP",
          "p": 3,
          "w": 1,
          "d": 0,
          "l": 2,
          "gf": 4,
          "ga": 5,
          "pts": 2
        },
        {
          "team": "SUI",
          "p": 3,
          "w": 0,
          "d": 0,
          "l": 3,
          "gf": 1,
          "ga": 9,
          "pts": 0
        }
      ],
      "stage": "group"
    },
    {
      "letter": "C",
      "standings": [
        {
          "team": "POR",
          "p": 3,
          "w": 3,
          "d": 0,
          "l": 0,
          "gf": 9,
          "ga": 2,
          "pts": 6
        },
        {
          "team": "HUN",
          "p": 3,
          "w": 2,
          "d": 0,
          "l": 1,
          "gf": 7,
          "ga": 5,
          "pts": 4
        },
        {
          "team": "BRA",
          "p": 3,
          "w": 1,
          "d": 0,
          "l": 2,
          "gf": 4,
          "ga": 6,
          "pts": 2
        },
        {
          "team": "BUL",
          "p": 3,
          "w": 0,
          "d": 0,
          "l": 3,
          "gf": 1,
          "ga": 8,
          "pts": 0
        }
      ],
      "stage": "group"
    },
    {
      "letter": "D",
      "standings": [
        {
          "team": "URS",
          "p": 3,
          "w": 3,
          "d": 0,
          "l": 0,
          "gf": 6,
          "ga": 1,
          "pts": 6
        },
        {
          "team": "PRK",
          "p": 3,
          "w": 1,
          "d": 1,
          "l": 1,
          "gf": 2,
          "ga": 4,
          "pts": 3
        },
        {
          "team": "ITA",
          "p": 3,
          "w": 1,
          "d": 0,
          "l": 2,
          "gf": 2,
          "ga": 2,
          "pts": 2
        },
        {
          "team": "CHI",
          "p": 3,
          "w": 0,
          "d": 1,
          "l": 2,
          "gf": 2,
          "ga": 5,
          "pts": 1
        }
      ],
      "stage": "group"
    },
    {
      "letter": "EUR2",
      "standings": [
        {
          "team": "FRG",
          "p": 4,
          "w": 3,
          "d": 1,
          "l": 0,
          "gf": 14,
          "ga": 2,
          "pts": 7
        },
        {
          "team": "SWE",
          "p": 4,
          "w": 2,
          "d": 1,
          "l": 1,
          "gf": 10,
          "ga": 3,
          "pts": 5
        },
        {
          "team": "CYP",
          "p": 4,
          "w": 0,
          "d": 0,
          "l": 4,
          "gf": 0,
          "ga": 19,
          "pts": 0
        }
      ],
      "stage": "qualifyingGroup"
    },
    {
      "letter": "EUR3",
      "standings": [
        {
          "team": "FRA",
          "p": 6,
          "w": 5,
          "d": 0,
          "l": 1,
          "gf": 9,
          "ga": 2,
          "pts": 10
        },
        {
          "team": "NOR",
          "p": 6,
          "w": 3,
          "d": 1,
          "l": 2,
          "gf": 10,
          "ga": 5,
          "pts": 7
        },
        {
          "team": "YUG",
          "p": 6,
          "w": 3,
          "d": 1,
          "l": 2,
          "gf": 10,
          "ga": 8,
          "pts": 7
        },
        {
          "team": "LUX",
          "p": 6,
          "w": 0,
          "d": 0,
          "l": 6,
          "gf": 6,
          "ga": 20,
          "pts": 0
        }
      ],
      "stage": "qualifyingGroup"
    },
    {
      "letter": "EUR4",
      "standings": [
        {
          "team": "POR",
          "p": 6,
          "w": 4,
          "d": 1,
          "l": 1,
          "gf": 9,
          "ga": 4,
          "pts": 9
        },
        {
          "team": "TCH",
          "p": 6,
          "w": 3,
          "d": 1,
          "l": 2,
          "gf": 12,
          "ga": 4,
          "pts": 7
        },
        {
          "team": "ROU",
          "p": 6,
          "w": 3,
          "d": 0,
          "l": 3,
          "gf": 9,
          "ga": 7,
          "pts": 6
        },
        {
          "team": "TUR",
          "p": 6,
          "w": 1,
          "d": 0,
          "l": 5,
          "gf": 4,
          "ga": 19,
          "pts": 2
        }
      ],
      "stage": "qualifyingGroup"
    },
    {
      "letter": "EUR5",
      "standings": [
        {
          "team": "SUI",
          "p": 6,
          "w": 4,
          "d": 1,
          "l": 1,
          "gf": 7,
          "ga": 3,
          "pts": 9
        },
        {
          "team": "NIR",
          "p": 6,
          "w": 3,
          "d": 2,
          "l": 1,
          "gf": 9,
          "ga": 5,
          "pts": 8
        },
        {
          "team": "NED",
          "p": 6,
          "w": 2,
          "d": 2,
          "l": 2,
          "gf": 6,
          "ga": 4,
          "pts": 6
        },
        {
          "team": "ALB",
          "p": 6,
          "w": 0,
          "d": 1,
          "l": 5,
          "gf": 2,
          "ga": 12,
          "pts": 1
        }
      ],
      "stage": "qualifyingGroup"
    },
    {
      "letter": "EUR6",
      "standings": [
        {
          "team": "HUN",
          "p": 4,
          "w": 3,
          "d": 1,
          "l": 0,
          "gf": 8,
          "ga": 3,
          "pts": 7
        },
        {
          "team": "GDR",
          "p": 4,
          "w": 1,
          "d": 2,
          "l": 1,
          "gf": 5,
          "ga": 5,
          "pts": 4
        },
        {
          "team": "AUT",
          "p": 4,
          "w": 0,
          "d": 1,
          "l": 3,
          "gf": 1,
          "ga": 6,
          "pts": 1
        }
      ],
      "stage": "qualifyingGroup"
    },
    {
      "letter": "EUR7",
      "standings": [
        {
          "team": "URS",
          "p": 6,
          "w": 5,
          "d": 0,
          "l": 1,
          "gf": 19,
          "ga": 6,
          "pts": 10
        },
        {
          "team": "WAL",
          "p": 6,
          "w": 3,
          "d": 0,
          "l": 3,
          "gf": 11,
          "ga": 9,
          "pts": 6
        },
        {
          "team": "GRE",
          "p": 6,
          "w": 2,
          "d": 1,
          "l": 3,
          "gf": 10,
          "ga": 14,
          "pts": 5
        },
        {
          "team": "DEN",
          "p": 6,
          "w": 1,
          "d": 1,
          "l": 4,
          "gf": 7,
          "ga": 18,
          "pts": 3
        }
      ],
      "stage": "qualifyingGroup"
    },
    {
      "letter": "EUR8",
      "standings": [
        {
          "team": "ITA",
          "p": 6,
          "w": 4,
          "d": 1,
          "l": 1,
          "gf": 17,
          "ga": 3,
          "pts": 9
        },
        {
          "team": "SCO",
          "p": 6,
          "w": 3,
          "d": 1,
          "l": 2,
          "gf": 8,
          "ga": 8,
          "pts": 7
        },
        {
          "team": "POL",
          "p": 6,
          "w": 2,
          "d": 2,
          "l": 2,
          "gf": 11,
          "ga": 10,